{
  "$schema": "schemas/registry-manifest.schema.json",
  "schemaVersion": 1,
  "sequence": 115,
  "generatedAt": "2026-10-16T06:20:27.6517208+00:00",
  "files": [
    {
      "path": "categories.json",
      "sha256": "60c12082385a82c943387afdccbf0a32696d9c731e6093deea3eea92c0adc255",
      "size": 2179
    },
    {
      "path": "certificates/cert_0847db56391b0d038cd1fac4a8058dca.json",
      "sha256": "fbbe33e6cf8e98f58209537799a45799ddfe765c06b97e42221e71f4cfd1aec3",
      "size": 579
    },
    {
      "path": "certificates/cert_0847db56391b0d038cd1fac4a8058dca.sig",
      "sha256": "f8442b7c07cde3dd98665beeab85c80c4977507f4697044228e47a71fdaf362c",
      "size": 89
    },
    {
      "path": "certificates/cert_08c01ca2710a7f395f90d5ea764f820f.json",
      "sha256": "a523c182f90aa88143dd0120fa1d65c0e501f7e40f661c9663ba743a4f422805",
      "size": 571
    },
    {
      "path": "certificates/cert_08c01ca2710a7f395f90d5ea764f820f.sig",
      "sha256": "2cda51ae27dd7e95805e9b0c65a9877546f42749b2580022811c29bf72d5f3be",
      "size": 89
    },
    {
      "path": "certificates/cert_0f3c8d979e74b2dd76f6bf9cea203d09.json",
      "sha256": "7c2de5e0de3032e2e108da7c563aa955e0b95b45c004a4e2a149b0c52a7999c1",
      "size": 574
    },
    {
      "path": "certificates/cert_0f3c8d979e74b2dd76f6bf9cea203d09.sig",
      "sha256": "908fda89b167a2bdbc13a466dde59c74ef260b44e4dd1017c3e6aabab1b331dd",
      "size": 89
    },
    {
      "path": "certificates/cert_1ec60d31501768b730eef9d8ee219c06.json",
      "sha256": "d005acb1be52114e96117181a8d4955cc770ce59caad97d38f456b3e91bcddb9",
      "size": 607
    },
    {
      "path": "certificates/cert_1ec60d31501768b730eef9d8ee219c06.sig",
      "sha256": "a556b32975cf85e4ebeb7976bc97f30f56a37ea7033c6bb89e95b14afbc59cfa",
      "size": 89
    },
    {
      "path": "certificates/cert_2de3c9ca229f808270f5feaf5a768fcf.json",
      "sha256": "67dd81abba3a8e133cbe06e1c73d4c8f44d9d6beee7819d50293a5f2fc22ad92",
      "size": 569
    },
    {
      "path": "certificates/cert_2de3c9ca229f808270f5feaf5a768fcf.sig",
      "sha256": "1469633eb1091d2e8cf14e3721802c8dcb76e73a2e6c6e2bc41a8402c961276f",
      "size": 89
    },
    {
      "path": "certificates/cert_3297969e022607b578fcd383e43c9122.json",
      "sha256": "5614a6cef086d4c6aa1c381ddc3dbce73ebe997d9c792f908c132ec878173d3b",
      "size": 575
    },
    {
      "path": "certificates/cert_3297969e022607b578fcd383e43c9122.sig",
      "sha256": "9823615b2ca97cbf802313e67689c17f52035a733ab8641df420c0a7d358bb81",
      "size": 89
    },
    {
      "path": "certificates/cert_4f28d56c6846a7c85b4457c742e3a390.json",
      "sha256": "b3dfa7d3e7b7a0e5e2675778d1aa28f9e91047720c5b99646654cb51295a3c28",
      "size": 583
    },
    {
      "path": "certificates/cert_4f28d56c6846a7c85b4457c742e3a390.sig",
      "sha256": "2204088202dd8c754fc07cbc03035f41683de75392ef87e008d4bbf6bb47ba18",
      "size": 89
    },
    {
      "path": "certificates/cert_669c27a5c81aa171bf802c9dac5f63cb.json",
      "sha256": "36b3167583569137f2f6b16a5da618d0503547955e6056ec86704ee07d393d10",
      "size": 579
    },
    {
      "path": "certificates/cert_669c27a5c81aa171bf802c9dac5f63cb.sig",
      "sha256": "0c7e329cf2d07f40a80282f1a17f3daa3c0b7501b93e7f3841297797dbe0bf31",
      "size": 89
    },
    {
      "path": "certificates/cert_7cc0e4aaea428037548461cd01b9a94f.json",
      "sha256": "a6f89a45e484eae00ea5d8f7eb343f4ade4b466daf4e86dd56ad3d397d2899d4",
      "size": 540
    },
    {
      "path": "certificates/cert_7cc0e4aaea428037548461cd01b9a94f.sig",
      "sha256": "185ff558547f24364dc5ea48848184722a3f1ecb5f4a02dabbd6e29411418d54",
      "size": 89
    },
    {
      "path": "certificates/cert_7fdc410881e5a1181452d677e9950281.json",
      "sha256": "1399fbf1e895fa47ae5a342b69e2f1806a29d9772cb75f8273c044e6ba92c5d8",
      "size": 579
    },
    {
      "path": "certificates/cert_7fdc410881e5a1181452d677e9950281.sig",
      "sha256": "fd33aed4408d32f0ea255fcaf3d6031098fd66a2b51aa4775c16870f05ba7da5",
      "size": 89
    },
    {
      "path": "certificates/cert_86a3a9ee00df83e4ae7e21ce35a405e4.json",
      "sha256": "23c4fe7864751938187493f814a778ed4aba92d6e6b980dd6ecfb6b0da41be32",
      "size": 586
    },
    {
      "path": "certificates/cert_86a3a9ee00df83e4ae7e21ce35a405e4.sig",
      "sha256": "756b8ecb30cbf9397c9fa0a972c18cce93ae14e40294b21bd59df3639088c7d6",
      "size": 89
    },
    {
      "path": "certificates/cert_8b7414f6bc39d565f2c0e72ea5a6e3b5.json",
      "sha256": "c24c716ae2e2ac007aae3901e3c837f09d1150839288bb6a1f605f4216901994",
      "size": 581
    },
    {
      "path": "certificates/cert_8b7414f6bc39d565f2c0e72ea5a6e3b5.sig",
      "sha256": "f2d1dd401d52bc14b19393de182f60b158a7c279cd7ffc6a3025c18a0c20cda0",
      "size": 89
    },
    {
      "path": "certificates/cert_8c8eb350d5aa84e85357fe811c13a61e.json",
      "sha256": "147a71a453c1462d16e4ad966ac674639f6e33be308b14b002bbc9161fe1d882",
      "size": 603
    },
    {
      "path": "certificates/cert_8c8eb350d5aa84e85357fe811c13a61e.sig",
      "sha256": "6ec2c408b4c332958a9b392154a188c668431c68f224386a2a43da91211827dd",
      "size": 89
    },
    {
      "path": "certificates/cert_94eaac43fef51cc1f2cdc9ff1de511f5.json",
      "sha256": "b0422238d4d0745f346e0e2525c330e29b399e3e4415b0712564709c79091618",
      "size": 583
    },
    {
      "path": "certificates/cert_94eaac43fef51cc1f2cdc9ff1de511f5.sig",
      "sha256": "bf192eb495c63183b28d83e3ee9346022808963b6bf48b838645e793c3c19898",
      "size": 89
    },
    {
      "path": "certificates/cert_9974b9fc2dd4afedc436578a2aa46048.json",
      "sha256": "9d59a39f8b4ce08bdca6729b32e1a4a30148d67e8402fd81c98fcfd205feb6c3",
      "size": 576
    },
    {
      "path": "certificates/cert_9974b9fc2dd4afedc436578a2aa46048.sig",
      "sha256": "32235b7f7705f1add1a2de1823a7e7f0246044cb80c8c9f1439197b99812fa87",
      "size": 89
    },
    {
      "path": "certificates/cert_a7cbe69a2f7c06c17e19c41472e2d996.json",
      "sha256": "24a1ef98d6a0b6f58b583621655392e2611501203aaf6a27ad248226e6393622",
      "size": 576
    },
    {
      "path": "certificates/cert_a7cbe69a2f7c06c17e19c41472e2d996.sig",
      "sha256": "a70df4a01a0321319eee0ee7bdbfd00fb38284a0e577dd3e1faabc36d5497486",
      "size": 89
    },
    {
      "path": "certificates/cert_bbc3c01c4fbd30b35075f1c945e68838.json",
      "sha256": "fe09124b5918b86a985181e2755a45f0234ab8a89e4950ffb408f5029610ef71",
      "size": 580
    },
    {
      "path": "certificates/cert_bbc3c01c4fbd30b35075f1c945e68838.sig",
      "sha256": "56cc5ef6b7f2ea7eaf5d234e451c9bb1735015ae702743817a8f7e5f547b009b",
      "size": 89
    },
    {
      "path": "certificates/cert_c1954f6d2e7f4a58934a878774892d42.json",
      "sha256": "b354bce5ae2169d383875c16efb69d150a9da06cbb496e25b3e937a19cf265f0",
      "size": 572
    },
    {
      "path": "certificates/cert_c1954f6d2e7f4a58934a878774892d42.sig",
      "sha256": "e01a632272b369ecb233ca5ddf5fcb364f0290b542855009e0fc6b44082f20a8",
      "size": 89
    },
    {
      "path": "certificates/cert_c240981952797563babdcdc959e7f4fb.json",
      "sha256": "d5af7a6b07b6dc7c34713886cb2d4d33c5d55021b62eb02ba17ac5b9586578f3",
      "size": 580
    },
    {
      "path": "certificates/cert_c240981952797563babdcdc959e7f4fb.sig",
      "sha256": "001a3dd0f912c2498e6334e01f6e8432da4a6a13cab13ff7852b7e65951a7ee9",
      "size": 89
    },
    {
      "path": "certificates/cert_db71fb64d9549ef79b4d03636a17972d.json",
      "sha256": "e99d898603fed7e08a0c60cf0d411875ef926a25282c7bf14c6191345da4fae0",
      "size": 582
    },
    {
      "path": "certificates/cert_db71fb64d9549ef79b4d03636a17972d.sig",
      "sha256": "7e163a650bb38b499dcb0df176338e25c1e2422c6b1f700525f3d3b314627fa2",
      "size": 89
    },
    {
      "path": "certificates/cert_ddab76ce61e3b07ef827219022b2d6b5.json",
      "sha256": "6646dace32f9146b2cdc9a38131b255b6ffb2066fee7438cb56082cc25debf64",
      "size": 572
    },
    {
      "path": "certificates/cert_ddab76ce61e3b07ef827219022b2d6b5.sig",
      "sha256": "157c25a6e2397e1d86ad25d3c9a7f7626feb2719219506c56b0507f20b316a6c",
      "size": 89
    },
    {
      "path": "certificates/cert_eb174f226e5fcec700f435000b5d0b1f.json",
      "sha256": "ccaab33dd631629334d56de56a467e41e44bff2938294a1d16014899244bbb49",
      "size": 585
    },
    {
      "path": "certificates/cert_eb174f226e5fcec700f435000b5d0b1f.sig",
      "sha256": "ba80326109c86361267018eeaf99be0f0040551a4986db22a5d99d180d6372b1",
      "size": 89
    },
    {
      "path": "certificates/cert_f34627bdfe0b588ec69f99927f9e66cf.json",
      "sha256": "b48bec72faff88804cf851b10160521cad970760cb1eb4aa0904b702a9c61a37",
      "size": 606
    },
    {
      "path": "certificates/cert_f34627bdfe0b588ec69f99927f9e66cf.sig",
      "sha256": "9de7c68343d60a5754ed00841a7251ef095432d794aa81681d9a49a536b7054b",
      "size": 89
    },
    {
      "path": "icon-packs/com.fire.black-gold-luxury/manifest.json",
      "sha256": "3f96c735fa989d4ad393547cbd8e768b744dae317a8118fe49d01751fec95e91",
      "size": 694
    },
    {
      "path": "icon-packs/com.fire.black-gold-luxury/versions/1.0.0/changelog.md",
      "sha256": "ac3d8a5c0190be87645529024369f77c4a4ab0bbfb4d58fe10e41e96d441626a",
      "size": 102
    },
    {
      "path": "icon-packs/com.fire.black-gold-luxury/versions/1.0.0/description.md",
      "sha256": "a05c806d69fe54e45f419b28c15628ca1dd5a0f0a5085c0e32891a87de061084",
      "size": 328
    },
    {
      "path": "icon-packs/com.fire.black-gold-luxury/versions/1.0.0/manifest.json",
      "sha256": "e56cfba5a318c56ce1d23113c56217fd130272b47c9d90dd3ffc9ebb40d69a3b",
      "size": 1087
    },
    {
      "path": "icon-packs/com.simplyjames.mdi-icons/manifest.json",
      "sha256": "892ce52a7592f23ea4655f32a1f59d7f63ac12fdab898d8be669f532e7a8982d",
      "size": 521
    },
    {
      "path": "icon-packs/com.simplyjames.mdi-icons/versions/1.0.0/changelog.md",